{
  "org": "openIndu",
  "base_url": "https://github.com/openIndu",
  "mirror": {
    "gitee": "https://gitee.com/openIndu",
    "note": "Since 2026-06-20 all repos migrated to GitHub, origin=GitHub; Gitee is only the infra-deploy manifest repo and a backup mirror."
  },
  "repos": {
    "control-tower": {
      "url": "https://github.com/openIndu/control-tower",
      "phase": "brain",
      "type": "control-tower",
      "description": "openIndu independent control layer: maintains routing info, Agent principles, agent definitions; directs sub-repo template/script/Agent-prompt updates."
    },
    "openindu-website": {
      "url": "https://github.com/openIndu/openindu-website",
      "phase": "aggregate",
      "type": "aggregate",
      "submodules": ["openindu-backend", "openindu-admin", "openindu-portal"],
      "local_path_hint": "../openIndu-website",
      "description": "Aggregate dev repo: submodule-aggregates backend + admin + portal; docker-compose local stack; RULE 11 steps 4+5 entry is this repo's own /release command (not the plugin's /build)."
    },
    "openindu-backend": {
      "url": "https://github.com/openIndu/openindu-backend",
      "phase": "backend",
      "type": "backend",
      "aggregate": "openindu-website",
      "image": "${OPENINDU_REGISTRY}/openindu/openindu-backend",
      "production_db": {
        "host": "${OPENINDU_PROD_DB_HOST}",
        "port": "${OPENINDU_PROD_DB_PORT}",
        "database": "${OPENINDU_PROD_DB_NAME}",
        "note": "RULE 10 production-SQL protection target. Host, port, database and credentials are all injected via vault or env — never committed to this repo."
      },
      "description": "FastAPI Web API (8004) + MCP Server (8005); depends on PostgreSQL + Milvus + Aliyun OSS."
    },
    "openindu-admin": {
      "url": "https://github.com/openIndu/openindu-admin",
      "phase": "frontend",
      "type": "admin",
      "aggregate": "openindu-website",
      "image": "${OPENINDU_REGISTRY}/openindu/openindu-admin",
      "domain": "admin.openindu.com",
      "description": "React 19 + Vite 6 unified admin (admin/member/regular-user tiers)."
    },
    "openindu-portal": {
      "url": "https://github.com/openIndu/openindu-portal",
      "phase": "frontend",
      "type": "portal",
      "aggregate": "openindu-website",
      "image": "${OPENINDU_REGISTRY}/openindu/openindu-portal",
      "domain": "openindu.com",
      "description": "React 19 + Vite 6 community front-end (anonymous + authenticated)."
    },
    "openindu-studio": {
      "url": "https://github.com/openIndu/openindu-studio",
      "mirror_gitee": "https://gitee.com/openIndu/openIndu-studio",
      "phase": "tooling",
      "type": "studio",
      "primary_language": "python",
      "modules": ["converters", "local-rag-mcp", "scripts"],
      "authoritative_host": "github",
      "release_flow": "independent library — not in the openindu-website submodule aggregate; produces no container image and has no manifest in infra-deploy, so delivery ends at its own reviewed repository change",
      "description": "AI-assisted PLC/HMI program development toolchain: electrical-module survey, circuit design, BOM generation, IO-address planning through PLC/HMI programming; includes RAG knowledge base and MCP tools. Python 99%. GitHub is the authoritative source (confirmed 2026-08-04); Gitee is mirror only — if a local clone points at Gitee, switch origin."
    },
    "openindu-platform": {
      "url": "https://github.com/openIndu/openindu-platform",
      "phase": "platform",
      "type": "platform",
      "polyglot_monorepo": true,
      "release_flow": "independent — not in the openindu-website submodule aggregate; image build and deploy per its own pipeline",
      "modules": [
        {
          "path": "openindu-backend",
          "manifest": "pom.xml",
          "language": "java"
        },
        {
          "path": "openindu-website",
          "manifest": "package.json",
          "language": "vue"
        },
        {
          "path": "openindu-collector",
          "manifest": "pyproject.toml",
          "language": "python"
        },
        {
          "path": "openindu-app",
          "manifest": "package.json",
          "language": "vue-uniapp"
        },
        {
          "path": "openindu-website-next",
          "manifest": "package.json",
          "language": "typescript"
        },
        {
          "path": "openindu-gateway",
          "manifest": "requirements.txt",
          "language": "python",
          "pending_rewrite": {
            "target_language": "rust",
            "branch": "feat/frontend-react-refactor",
            "status": "pushed, not merged to main",
            "note": "Python→Rust rewrite (Modbus driver / edge alarm / data transform). Rust file count on main is 0; the rust role covers this in-flight work."
          }
        }
      ],
      "description": "Industrial-internet platform (IIoT base): device access, data pipeline, application runtime (platform layer). Long-term moat. Polyglot monorepo — a single type can't express its stack; dispatch must descend to module granularity."
    },
    "openindu-station": {
      "url": "https://github.com/openIndu/openindu-station",
      "phase": "application",
      "type": "station",
      "primary_language": "csharp",
      "modules": [
        "src/OpenIndu.Station.Core",
        "src/OpenIndu.Station.Platform",
        "src/OpenIndu.Station.Motion",
        "src/OpenIndu.Station.Vision",
        "src/OpenIndu.Station.Scan",
        "src/OpenIndu.Station.App.Dispense",
        "src/OpenIndu.Station.App.LaserCut",
        "tests/OpenIndu.Station.Verify"
      ],
      "pending_split": {
        "pr": "openIndu/openindu-station#173",
        "branch": "refactor/extract-vision-and-scan",
        "status": "open, CI blocked on the SUBMODULE_TOKEN secret",
        "note": "src/OpenIndu.Station.Vision → openIndu-vision and src/OpenIndu.Station.Scan → openIndu-cim, remounted as submodules at the same paths. The `modules` list above still names all 8 because #173 has not merged and main still holds the sources. Once it merges, drop those two entries here — the GitHub tree API does not traverse submodules, so scripts/detect-modules.mjs will start reporting 6 modules for this repo and --check would otherwise fail."
      },
      "description": "Self-developed station app (described as openindu-motor): 8 .csproj, 180 .cs. Includes motion control, vision, scan, dispensing and laser-cutting apps. The only repo in the org with a standalone test project (Verify)."
    },
    "openIndu-vision": {
      "url": "https://github.com/openIndu/openIndu-vision",
      "phase": "application",
      "type": "vision",
      "status": "active",
      "primary_language": "csharp",
      "aggregate": "openindu-station",
      "mount_path": "src/OpenIndu.Station.Vision",
      "modules": ["."],
      "delivery_owner": "station-control",
      "release_flow": "source / submodule-only, per openIndu-vision-product/spec/vision-001-form-and-contracts.md. The vision code still lives in-tree at openindu-station/src/OpenIndu.Station.Vision (a directory on openindu-station/main, no .gitmodules yet); openindu-station#173, a stalled all-in-one vision+scan split, is unmerged and superseded for vision by spec/vision-001, which re-extracts vision alone from current openindu-station/main and mounts it back at the same path as a submodule of openindu-station. No mirror, no container image, no infra-deploy manifest — RULE 11 ends at the parent's submodule-pointer PR in openindu-station; changing it is a two-PR flow (this repo, then the pointer bump). Goal per spec/vision-001, not yet true: the kernel builds standalone under `dotnet build` once the Vision.Contracts extraction severs the relative-path dependency on OpenIndu.Station.Core. Standalone CLI / IDE distribution is out of scope for vision-001 — a future spec covers it (see spec/vision-001 §4.7).",
      "description": "Vision subsystem: camera HAL (Hikvision MVS / Cognex In-Sight / simulator), calibration, and vision tools (BlobLocator / OpenCvSharp4 / MVTec Halcon). net48, x64, WinForms. The three vendor SDKs are conditionally compiled — their commercial DLLs are never redistributed, so a machine without them still builds cleanly. This repo's current content (7491063a) is a stale 2026-08-25 subtree-split snapshot — no consumer, missing openindu-station a1b8d85's CognexCamera fix; spec/vision-001's clean re-extraction resets it."
    },
    "openIndu-cim": {
      "url": "https://github.com/openIndu/openIndu-cim",
      "phase": "application",
      "type": "cim",
      "primary_language": "csharp",
      "aggregate": "openindu-station",
      "mount_path": "src/OpenIndu.Station.Scan",
      "modules": ["."],
      "delivery_owner": "station-control",
      "release_flow": "submodule — mounted into openindu-station at src/OpenIndu.Station.Scan. No image, no infra-deploy manifest, so RULE 11 ends at the parent's submodule-pointer PR. Does NOT build standalone, same Core relative-path reason as openIndu-vision.",
      "description": "CIM subsystem (product traceability), split out of openindu-station on 2026-08-25 with its own history preserved (git subtree split, 3 commits). Today it holds one module — the barcode-scanner HAL (Cognex DataMan / simulator). Broader CIM capability (traceability records, MES/ERP interfaces, work-order flow) is intended to land here rather than back in the station repo. net48, x64. The DataMan SDK is conditionally compiled."
    },
    "openIndu-controller": {
      "url": "https://github.com/openIndu/openIndu-controller",
      "phase": "edge",
      "type": "controller",
      "primary_language": "csharp",
      "modules": ["openInduCore", "openInduVision", "openPlatform"],
      "release_flow": "independent — not in the openindu-website submodule aggregate; edge deploy differs from cluster",